{
  "schema": "urn:aihq:workbench:journey-envelope:1.0.0",
  "id": "journey-dcad8e3e9aefffdb9fdef207e7137fc1",
  "revision": {
    "sequence": 18,
    "sha256": "90fb84df27c7eeed870866824b24da843b1b13d04aaeb4c05c79b1d642b9b0dd",
    "previousSha256": "8bea85e9bf71ce890f9b0435f393ebc8a14d2ceab282d579f821d5acf655c2bf"
  },
  "executable": false,
  "savedIntent": {
    "type": "urn:aihq:core:execution-policy-bytes",
    "mediaType": "application/json",
    "sha256": "dcad8e3e9aefffdb9fdef207e7137fc183b30c267f872c8408bb1e9c0a1822bb",
    "byteLength": 366,
    "base64": "eyJzY2hlbWEiOiJ1cm46YWlocTpjb3JlOmV4ZWN1dGlvbi1wb2xpY3k6MS4zLjAiLCJtb2RlIjoiZW50ZXJwcmlzZSIsInNlbGVjdGlvbnMiOltdLCJtZXRhZGF0YSI6eyJhaWgud29ya2JlbmNoIjp7InNjaGVtYSI6InVybjphaWhxOndvcmtiZW5jaDpzYXZlZC1pbnRlbnQ6My4wLjAiLCJvcmlnaW5zIjpbeyJpZCI6ImRpcmVjdCIsImtpbmQiOiJkaXJlY3QifV0sInJvb3RzIjpbXSwiZXhjbHVzaW9ucyI6W10sInBpbnMiOltdLCJwcm92ZW5hbmNlIjpbXSwiaW5wdXRzIjpbXSwicmV2aWV3cyI6eyJzY2hlbWEiOiJ1cm46YWlocTp3b3JrYmVuY2g6cmV2aWV3LWRlY2lzaW9uczoxLjAuMCIsInJlY29yZHMiOltdLCJoaXN0b3J5IjpbXX19fX0K"
  },
  "records": [
    {
      "id": "organization-draft",
      "schema": "urn:aihq:workbench:journey-record:organization-draft:1.0.0",
      "required": true,
      "entries": [
        {
          "id": "entry-8ee9b0207fbe1faf085ba39314f4f36a",
          "item": {
            "releaseSha256": "0ff699f240ac4c667c1891fe0f0a2629c60af67dfb1d9483405d2bbc45d6f124",
            "itemId": "mattpocock.implement",
            "itemSha256": "592840b886fcec3abec949a5c4bd3aa61eb02324aa0236e4cc3450c8dabb99b5"
          },
          "scope": "project",
          "inputs": {
            "agentDirectory": {
              "fixed": ".claude"
            }
          },
          "obligation": "required"
        },
        {
          "id": "entry-0b38bca339db66d914c38ef14a1d87fb",
          "item": {
            "releaseSha256": "0ff699f240ac4c667c1891fe0f0a2629c60af67dfb1d9483405d2bbc45d6f124",
            "itemId": "mattpocock.code-review",
            "itemSha256": "6f23fe0ec120e931d54b9a6a411cb210775bf3e39b550b65fb5da3f1bb22463e"
          },
          "scope": "project",
          "inputs": {},
          "obligation": "prohibited"
        },
        {
          "id": "entry-7ce37160b35938d52e83fc42c7f916bd",
          "item": {
            "releaseSha256": "0ff699f240ac4c667c1891fe0f0a2629c60af67dfb1d9483405d2bbc45d6f124",
            "itemId": "mattpocock.tdd",
            "itemSha256": "d74745cdb22b649b7ceda221c17fc2e077d3beb43a06fd9ab4a4c1b243bdae0d"
          },
          "scope": "user",
          "inputs": {
            "agentDirectory": {
              "fixed": ".claude"
            }
          },
          "obligation": "required"
        },
        {
          "id": "entry-8d36eef2d7874252200d0a698daa3987",
          "item": {
            "releaseSha256": "0ff699f240ac4c667c1891fe0f0a2629c60af67dfb1d9483405d2bbc45d6f124",
            "itemId": "mattpocock.grilling",
            "itemSha256": "3b42918b2034af33e0cde693386b30fdd1256acab4c2374d3d3aa8060676f2fa"
          },
          "scope": "project",
          "inputs": {
            "agentDirectory": {
              "fixed": ".claude"
            }
          },
          "obligation": "recommended"
        }
      ],
      "targets": [
        {
          "id": "target-0e236d87345d91dbda772d3816a9f9b8",
          "scope": "project",
          "client": "claude",
          "repository": "github.com/fixture-org/app"
        },
        {
          "id": "target-6a83c36d9fae40ad6deb7cedce67cc02",
          "scope": "user",
          "client": "claude"
        }
      ]
    }
  ]
}
